{
  "$schema": "../../docs/film-project.schema.draft.json",
  "id": "daoguang-history-film",
  "title": "一封军报如何变成朝廷的选择",
  "duration": 270,
  "events": {
    "opium-destruction": 17,
    "dinghai-falls": 55,
    "dispatch-north": 76,
    "memorial-arrives": 96,
    "decision": 115,
    "campaign": 176,
    "yangtze": 211,
    "treaty": 235,
    "reflection": 252,
    "end": 270
  },
  "tracks": {
    "sea.level": [
      [
        0,
        0
      ],
      [
        20,
        0.04
      ],
      [
        60,
        0.08
      ],
      [
        90,
        0.02
      ],
      [
        210,
        0.12
      ],
      [
        238,
        0.06
      ],
      [
        270,
        0
      ]
    ],
    "light.exposure": [
      [
        0,
        0.75
      ],
      [
        36,
        0.48
      ],
      [
        66,
        0.4
      ],
      [
        105,
        0.22
      ],
      [
        120,
        0.3
      ],
      [
        176,
        0.45
      ],
      [
        211,
        0.55
      ],
      [
        239,
        0.32
      ],
      [
        270,
        0.78
      ]
    ],
    "route.progress": [
      [
        0,
        0
      ],
      [
        76,
        0
      ],
      [
        86,
        0.55
      ],
      [
        96,
        1
      ],
      [
        210,
        1
      ],
      [
        211,
        0
      ],
      [
        230,
        1
      ],
      [
        270,
        1
      ]
    ]
  },
  "shots": [
    {
      "id": "opium-coast",
      "range": [
        0,
        55
      ],
      "lensMm": 36,
      "focusDistance": 35,
      "aperture": 5.6,
      "camera": {
        "from": [
          27,
          16,
          44
        ],
        "to": [
          22,
          13,
          38
        ],
        "targetOffset": [
          -7,
          4,
          0
        ]
      }
    },
    {
      "id": "dinghai",
      "range": [
        55,
        75
      ],
      "lensMm": 38,
      "focusDistance": 24,
      "aperture": 4,
      "camera": {
        "from": [
          30,
          17,
          45
        ],
        "to": [
          24,
          14,
          39
        ],
        "targetOffset": [
          -5,
          5,
          0
        ]
      }
    },
    {
      "id": "dispatch-map",
      "range": [
        75,
        96
      ],
      "lensMm": 42,
      "focusDistance": 30,
      "aperture": 5.6,
      "camera": {
        "from": [
          1,
          19,
          24
        ],
        "to": [
          0,
          17,
          19
        ],
        "targetOffset": [
          0,
          0,
          0
        ]
      }
    },
    {
      "id": "memorial-desk",
      "range": [
        96,
        115
      ],
      "lensMm": 46,
      "focusDistance": 18,
      "aperture": 2.8,
      "camera": {
        "from": [
          10,
          12,
          20
        ],
        "to": [
          7,
          10,
          17
        ],
        "targetOffset": [
          0,
          3,
          0
        ]
      }
    },
    {
      "id": "decision",
      "range": [
        115,
        135
      ],
      "lensMm": 43,
      "focusDistance": 25,
      "aperture": 4,
      "camera": {
        "from": [
          8,
          11,
          21
        ],
        "to": [
          5,
          9,
          18
        ],
        "targetOffset": [
          0,
          3,
          0
        ]
      }
    },
    {
      "id": "branch-choice",
      "range": [
        135,
        176
      ],
      "lensMm": 38,
      "focusDistance": 25,
      "aperture": 4,
      "camera": {
        "from": [
          30,
          16,
          44
        ],
        "to": [
          24,
          13,
          39
        ],
        "targetOffset": [
          -1,
          5,
          0
        ]
      }
    },
    {
      "id": "constraints",
      "range": [
        176,
        211
      ],
      "lensMm": 38,
      "focusDistance": 26,
      "aperture": 4,
      "camera": {
        "from": [
          35,
          17,
          46
        ],
        "to": [
          29,
          14,
          40
        ],
        "targetOffset": [
          5,
          5,
          -1
        ]
      }
    },
    {
      "id": "yangtze",
      "range": [
        211,
        235
      ],
      "lensMm": 37,
      "focusDistance": 40,
      "aperture": 5.6,
      "camera": {
        "from": [
          29,
          19,
          49
        ],
        "to": [
          22,
          16,
          43
        ],
        "targetOffset": [
          -1,
          5,
          1
        ]
      }
    },
    {
      "id": "treaty",
      "range": [
        235,
        252
      ],
      "lensMm": 43,
      "focusDistance": 17,
      "aperture": 2.8,
      "camera": {
        "from": [
          16,
          13,
          30
        ],
        "to": [
          12,
          11,
          26
        ],
        "targetOffset": [
          0,
          3,
          0
        ]
      }
    },
    {
      "id": "reflection",
      "range": [
        252,
        270
      ],
      "lensMm": 45,
      "focusDistance": 36,
      "aperture": 5.6,
      "camera": {
        "from": [
          20,
          13,
          28
        ],
        "to": [
          28,
          17,
          36
        ],
        "targetOffset": [
          0,
          2,
          0
        ]
      }
    }
  ]
}
